{
  "schema_version": "station_plan@1",
  "station_key": "baseline",
  "run_id": "run-20260616-0001",
  "intent": "Capture the deterministic baseline before agent implementation.",
  "inputs": {
    "command": "mix test"
  },
  "expected_outputs": [
    "command transcript",
    "structured status"
  ],
  "timeout_seconds": 600
}
